user_input,retrieved_contexts,reference_contexts,response,reference,faithfulness,answer_relevancy,context_precision,context_recall
Ban Chấp hành có vai trò gì trong việc tổ chức Chương trình Chào đón Tân sinh viên Khóa 51 tại Trường Đại học Kinh tế?,"['ởng cho sinh viên có thành tích xuất sắc trong năm học 2024 - 2025. 4 19h00 - 21h30 Đêm văn nghệ Chào đón Tân Sinh viên khoá 51. Hội Sinh viên Trường Đại học Kinh tế - Tham mưu Kế hoạch với Đảng ủy, Ban Giám hiệu Nhà Trường; - Thành lập Ban tổ chức Chương trình; - Xây dựng kinh phí triển khai các hoạt động chung; chuẩn bị toàn bộ nội dung, xây dựng chương trình, kế hoạch, địa điểm cho Chương trình. Các Liên chi Hội và các Câu lạc bộ, Đội, Nhóm trực thuộc - Triển khai Kế hoạch, tiến hành các công tác chuẩn bị trước ngày diễn ra chương trình. - Truyền thông chương trình đến các toàn thể sinh viên trong đơn vị. - Các Liên chi Hội và các Câu lạc bộ, Đội, Nhóm tiến hành tuyên truyền, hỗ trợ truyền thông và tích cực tham gia Chương trình Chào đón Tân Sinh viên khóa 51. Trên đây là kế hoạch tổ chức “Chương trình Chào đón Tân Sinh viên khóa 51”, Ban Chấp hành Hội Sinh viên Việt Nam Trường Đại học Kinh tế kính đề nghị các đơn vị nghiêm túc triển khai thực hiện có hiệu quả, góp phần vào thành công chung của chương trình. Nơi nhận: - Đảng uỷ, BGH Nhà trường (để b/c); - BTV Đoàn Trường (để b/c); - Các Liên chi Hội, CLB, Đội, Nhóm (để triển khai); - Lưu VP.', 'HỘI SINH VIÊN VIỆT NAM ĐẠI HỌC ĐÀ NẴNG BCH TRƯỜNG ĐẠI HỌC KINH TẾ *** Số: 22-KH/HSV-VP \n Đà Nẵng, ngày 23 tháng 9 năm 2025 KẾ HOẠCH Tổ chức Chương trình Chào đón Tân Sinh viên khóa 51 --------------------- Thực hiện Chương trình Công tác Hội và phong trào sinh viên năm học 2025 - 2026, Ban Chấp hành Hội Sinh viên Trường Đại học Kinh tế - Đại học Đà Nẵng xây dựng Kế hoạch tổ chức Chương trình Chào đón Tân Sinh viên khóa 51 với các nội dung cụ thể như sau: I. MỤC ĐÍCH, YÊU CẦU 1. Mục đích: - Chào mừng các bạn Tân Sinh viên khoá 51 của Trường Đại học Kinh tế - Đại học Đà Nẵng bước vào ngưỡng cửa Đại học; - Tạo môi trường, sân chơi bổ ích, giúp hứng thú cho các bạn sinh viên, tân sinh viên có tham gia các hoạt động đặc sắc của chương trình; - Có cơ hội giao lưu, tiếp xúc với các bạn sinh viên đồng trang lứa. - Tăng độ nhận diện, hình ảnh thương hiệu Trường Đại học Kinh tế - Đại học Đà Nẵng để chuẩn bị cho công tác tuyển sinh năm học mới.', 'HỘI SINH VIÊN VIỆT NAM ĐẠI HỌC ĐÀ NẴNG BCH TRƯỜNG ĐẠI HỌC KINH TẾ *** Số: 33-CV/HSV-VP “V/v triển khai chuẩn bị các nội dung Chương trình Chào đón Tân sinh viên Khóa 51” \n Đà Nẵng, ngày 23 tháng 9 năm 2025 Kính gửi: - Ban Chấp hành các Liên chi Hội; - Ban Điều hành, Ban Chủ nhiệm các Câu lạc bộ, Đội, Nhóm. Thực hiện Chương trình Công tác Hội và phong trào sinh viên năm học 2025 - 2026, Căn cứ vào Kế hoạch số 22-KH/HSV-VP về việc tổ chức Chương trình Chào đón Tân Sinh viên khoá 51, Ban Chấp hành Hội Sinh viên Trường Đại học Kinh tế - Đại học Đà Nẵng kính đề nghị các Liên chi Hội và các Câu lạc bộ, Đội, Nhóm triển khai một số nội dung chuẩn bị tham gia Chương trình Chào đón Tân Sinh viên khoá 51, cụ thể như sau: 1. Đối tượng tham gia: Sinh viên, tân sinh viên của Trường Đại học Kinh tế - Đại học Đà Nẵng: - Điều động bắt buộc đối với các Câu lạc bộ, Đội, Nhóm (phụ lục 1 kèm theo). Mỗi Câu lạc bộ, Đội, Nhóm thành lập đội thi với số lượng 20 thành viên trong đó 10 Tân sinh viên khoá 51, 10 sinh viên khoá 50 trở về trước.']","['## HỘI SINH VIÊN VIỆT NAM ĐẠI HỌC ĐÀ NẴNG **BCH TRƯỜNG ĐẠI HỌC KINH TẾ** *** ## Số: 33-CV/HSV-VP - _“V/v triển khai chuẩn bị các nội dung Chương trình Chào đón Tân sinh viên Khóa 51”_ _Đà Nẵng, ngày 23 tháng 9 năm 2025_ ## ** Kính gửi: - Ban Chấp hành các Liên chi Hội; - Ban Điều hành, Ban Chủ nhiệm các Câu lạc bộ, Đội, Nhóm** . Thực hiện Chương trình Công tác Hội và phong trào sinh viên năm học 2025 - 2026, Căn cứ vào Kế hoạch số 22-KH/HSV-VP về việc tổ chức Chương trình Chào đón Tân Sinh viên khoá 51, Ban Chấp hành Hội Sinh viên Trường Đại học Kinh tế - Đại học Đà Nẵng kính đề nghị các Liên chi Hội và các Câu lạc bộ, Đội, Nhóm triển khai một số nội dung chuẩn bị tham gia Chương trình Chào đón Tân Sinh viên khoá 51, cụ thể như sau: ## ** 1. Đối tượng tham gia:** Sinh viên, tân sinh viên của Trường Đại học Kinh tế - Đại học Đà Nẵng: - Điều động bắt buộc đối với các Câu lạc bộ, Đội, Nhóm (phụ lục 1 kèm theo). Mỗi Câu lạc bộ, Đội, Nhóm thành lập đội thi với số lượng 20 thành viên trong đó 10 Tân sinh viên khoá 51, 10 sinh viên khoá 50 trở về trước. - Khuyến khích tham gia đối với các Liên chi Hội. Mỗi Liên chi Hội thành lập đội thi với số lượng 20 thành viên trong đó 10 Tân sinh viên khoá 51, 10 sinh viên khoá 50 trở về trước. Danh sách đội thi được gửi về cho Ban Tổ Chức (BTC) theo địa chỉ email: congtachsvdhkt@gmail.com **trước 22h00 ngày 27/9/2025 (Thứ Bảy).** (Mẫu danh sách theo phụ lục 2). ## ** 2. Đăng ký tiết mục tham gia văn nghệ:** Bắt buộc mỗi Liên chi Hội và mỗi Câu lạc bộ, Đội, Nhóm tiến hành vận động thành viên của đơn vị tham gia tập luyện, chuẩn bị và đăng ký tiết mục tham gia biểu diễn tại đêm văn nghệ của Chương trình Chào đón Tân Sinh viên khoá 51 dự kiến tổ chức vào Thứ Bảy, ngày 11 tháng 10 năm 2025 tại khuôn viên Trường Đại học Kinh tế. Thông tin về tên tiết mục, thể loại, người phụ trách, file nhạc của đơn vị gửi về Hội Sinh viên Trường qua đường link form: https://bom.so/a1iAPP - Yêu cầu đảm bảo 100% đơn vị đăng ký tối thiểu 01 tiết mục văn nghệ. - Vòng loại trực tiếp dự kiến diễn ra vào Thứ Bảy ngày 05/10/2025 (Địa điểm cụ thể sẽ được thông báo sau). Hội Sinh viên sẽ tiến hành tổng duyệt qua các vòng để lựa chọn các tiết mục xuất sắc tham gia biểu diễn trong đêm văn nghệ. ## **- Hạn cuối gửi đăng ký: trước 11h00 ngày 30 tháng 9 năm 2025 (Thứ Ba).** ## **']","Ban Chấp hành Hội Sinh viên Trường Đại học Kinh tế có vai trò quan trọng trong việc tổ chức Chương trình Chào đón Tân sinh viên Khóa 51. Cụ thể, Ban Chấp hành thực hiện các nhiệm vụ sau: 1. **Xây dựng Kế hoạch tổ chức chương trình**: Ban Chấp hành đã xây dựng kế hoạch chi tiết cho chương trình, bao gồm các nội dung cụ thể và mục đích của chương trình. 2. **Tham mưu cho Đảng ủy, Ban Giám hiệu**: Ban Chấp hành phối hợp với Đảng ủy và Ban Giám hiệu Nhà Trường để triển khai kế hoạch tổ chức chương trình. 3. **Thành lập Ban tổ chức**: Ban Chấp hành có trách nhiệm thành lập Ban tổ chức cho chương trình, đảm bảo các hoạt động diễn ra suôn sẻ. 4. **Chuẩn bị nội dung và kinh phí**: Ban Chấp hành xây dựng kinh phí triển khai các hoạt động chung và chuẩn bị toàn bộ nội dung, chương trình, kế hoạch, địa điểm cho chương trình. 5. **Triển khai và giám sát**: Ban Chấp hành đề nghị các Liên chi Hội và các Câu lạc bộ, Đội, Nhóm triển khai kế hoạch và giám sát việc thực hiện các công tác chuẩn bị trước ngày diễn ra chương trình. 6. **Truyền thông**: Ban Chấp hành cũng có vai trò trong việc truyền thông chương trình đến toàn thể sinh viên trong đơn vị. Tóm lại, Ban Chấp hành đóng vai trò chủ chốt trong việc lập kế hoạch, tổ chức, giám sát và truyền thông cho Chương trình Chào đón Tân sinh viên Khóa 51.","Ban Chấp hành Hội Sinh viên Trường Đại học Kinh tế - Đại học Đà Nẵng có vai trò đề nghị các Liên chi Hội và các Câu lạc bộ, Đội, Nhóm triển khai một số nội dung chuẩn bị tham gia Chương trình Chào đón Tân sinh viên Khóa 51, bao gồm việc thành lập đội thi và đăng ký tiết mục tham gia văn nghệ.",0.8333333333333334,0.8196984093343479,0.9999999999666667,0.5
Hội Sinh viên là gì và tại sao nó lại quan trọng trong các hoạt động của sinh viên?,"['ởng cho sinh viên có thành tích xuất sắc trong năm học 2024 - 2025. 4 19h00 - 21h30 Đêm văn nghệ Chào đón Tân Sinh viên khoá 51. Hội Sinh viên Trường Đại học Kinh tế - Tham mưu Kế hoạch với Đảng ủy, Ban Giám hiệu Nhà Trường; - Thành lập Ban tổ chức Chương trình; - Xây dựng kinh phí triển khai các hoạt động chung; chuẩn bị toàn bộ nội dung, xây dựng chương trình, kế hoạch, địa điểm cho Chương trình. Các Liên chi Hội và các Câu lạc bộ, Đội, Nhóm trực thuộc - Triển khai Kế hoạch, tiến hành các công tác chuẩn bị trước ngày diễn ra chương trình. - Truyền thông chương trình đến các toàn thể sinh viên trong đơn vị. - Các Liên chi Hội và các Câu lạc bộ, Đội, Nhóm tiến hành tuyên truyền, hỗ trợ truyền thông và tích cực tham gia Chương trình Chào đón Tân Sinh viên khóa 51. Trên đây là kế hoạch tổ chức “Chương trình Chào đón Tân Sinh viên khóa 51”, Ban Chấp hành Hội Sinh viên Việt Nam Trường Đại học Kinh tế kính đề nghị các đơn vị nghiêm túc triển khai thực hiện có hiệu quả, góp phần vào thành công chung của chương trình. Nơi nhận: - Đảng uỷ, BGH Nhà trường (để b/c); - BTV Đoàn Trường (để b/c); - Các Liên chi Hội, CLB, Đội, Nhóm (để triển khai); - Lưu VP.', ' ngoại khóa trong trường. Hội Sinh viên tổng hợp các danh sách và gửi về Đoàn Trường thông qua địa chỉ email: doanthanhnien@due. vn trước ngày 13/4/2026 (Thứ 2). Nơi nhận:\n- Hội Sinh viên Trường;\n- Lưu: VP. BAN CHẤP HÀNH ĐOÀN TRƯỜNG \nBÍ THƯ\n \n(đã ký)\nTrần Xuân Quỳnh', ' đã, đang và sẽ tiếp tục khẳng định vai trò “dám nghĩ – dám làm – dám khởi nghiệp”, đóng góp vào sự phát triển kinh tế đất nước. Để phong trào này thực sự đi vào chiều sâu và bền vững, tuổi trẻ Trường Đại học Kinh tế – Đại học Đà Nẵng xin mạnh dạn đề xuất một số nội dung sau:\n1. Xây dựng hệ sinh thái khởi nghiệp trong sinh viên\n- Nhà trường và Đoàn thanh niên – Hội sinh viên cần tiếp tục kết nối chặt chẽ với doanh nghiệp, quỹ đầu tư, các tổ chức hỗ trợ khởi nghiệp để sinh viên không chỉ dừng lại ở cuộc thi, mà còn có cơ hội hiện thực hóa ý tưởng, tiếp cận thị trường và phát triển doanh nghiệp. - Thành lập hoặc phát triển thêm các Trung tâm ươm tạo khởi nghiệp trong trường đại học, nơi sinh viên có thể thử nghiệm mô hình, được cố vấn từ giảng viên, doanh nhân, cựu sinh viên thành đạt. - Duy trì các câu lạc bộ khởi nghiệp, gắn kết sinh viên có cùng đam mê để học hỏi, cùng nhau phát triển dự án. Đẩy mạnh hoạt động đào tạo và trang bị kỹ năng khởi nghiệp\n- Bên cạnh kiến thức chuyên môn, cần thường xuyên tổ chức các khóa tập huấn kỹ năng mềm như: kỹ năng quản trị tài chính, kỹ năng lập kế hoạch, gọi vốn, thuyết trình, thương lượng với nhà đầu tư.']","['3. Gửi video giới thiệu đơn vị** Để phục vụ cho việc giới thiệu về các Khoa, các Câu lạc bộ, Đội, Nhóm trong Đêm văn nghệ chào đón Tân Sinh viên Khoá 51, các đơn vị vui lòng gửi các clip của đơn vị mình vào link drive bên dưới. - Yêu cầu clip có thời lượng tối đa là 60 giây. - Chất lượng hình ảnh, âm thanh rõ nét với độ phân giải cao (HD, Full HD…), được - lưu bằng định dạng phổ biến avi, mpeg, mkv, klv, mp4... - Đường link gửi clip: https://bom.so/WTXYcS - Cú pháp đặt tên: [TÊN ĐƠN VỊ - VIDEO GIỚI THIỆU] - **Hạn cuối gửi clip: trước 11h00 ngày 05 tháng 10 năm 2025 (Thứ Bảy).** ** 4. Nội dung chi tiết của chương trình:** Chi tiết xem tại: https://bom.so/xUe3xw Nhận được công văn này, Ban Chấp hành Hội Sinh viên Trường Đại học Kinh tế đề nghị các đơn vị tiến hành triển khai công văn và thực hiện hiệu quả, đúng thời hạn các nội dung nêu trên. - _**Nơi nhận:**_ - Như trên; - Lưu VP. **TM. BAN CHẤP HÀNH HỘI SINH VIÊN TRƯỜNG ĐẠI HỌC KINH TẾ** CHỦ TỊCH **(Đã ký)** **Văn Công Vũ**']","Hội Sinh viên là tổ chức đại diện cho sinh viên trong trường, có nhiệm vụ tổ chức các hoạt động, sự kiện nhằm hỗ trợ và phát triển sinh viên, như chương trình chào đón tân sinh viên, các hoạt động ngoại khóa, và phong trào khởi nghiệp. Hội Sinh viên đóng vai trò quan trọng trong việc kết nối sinh viên với các cơ hội học tập, phát triển kỹ năng, và tạo ra môi trường giao lưu, học hỏi giữa các sinh viên. Từ tài liệu, Hội Sinh viên được nhắc đến trong bối cảnh tổ chức các chương trình chào đón tân sinh viên và phát triển phong trào khởi nghiệp, cho thấy vai trò của nó trong việc hỗ trợ sinh viên trong học tập và phát triển cá nhân. Hội cũng có trách nhiệm truyền thông và triển khai các hoạt động, góp phần vào sự thành công chung của các chương trình trong trường. Tóm lại, Hội Sinh viên quan trọng vì nó không chỉ là cầu nối giữa sinh viên với nhà trường mà còn là nơi hỗ trợ sinh viên phát triển kỹ năng, kết nối với doanh nghiệp và thực hiện các ý tưởng khởi nghiệp.","Hội Sinh viên là tổ chức đại diện cho sinh viên tại Trường Đại học Kinh tế, có vai trò quan trọng trong việc triển khai các hoạt động xã hội và hỗ trợ sinh viên. Công văn này đề nghị các đơn vị thực hiện hiệu quả các nội dung nêu trên, cho thấy sự quan tâm của Ban Chấp hành Hội Sinh viên đối với các hoạt động của sinh viên.",0.6470588235294118,0.8378895314599907,0.8333333332916666,1.0
What is the significance of Khuôn viên Trường Đại học Kinh tế in the welcome program for new students?,"['HỘI SINH VIÊN VIỆT NAM ĐẠI HỌC ĐÀ NẴNG BCH TRƯỜNG ĐẠI HỌC KINH TẾ *** Số: 22-KH/HSV-VP \n Đà Nẵng, ngày 23 tháng 9 năm 2025 KẾ HOẠCH Tổ chức Chương trình Chào đón Tân Sinh viên khóa 51 --------------------- Thực hiện Chương trình Công tác Hội và phong trào sinh viên năm học 2025 - 2026, Ban Chấp hành Hội Sinh viên Trường Đại học Kinh tế - Đại học Đà Nẵng xây dựng Kế hoạch tổ chức Chương trình Chào đón Tân Sinh viên khóa 51 với các nội dung cụ thể như sau: I. MỤC ĐÍCH, YÊU CẦU 1. Mục đích: - Chào mừng các bạn Tân Sinh viên khoá 51 của Trường Đại học Kinh tế - Đại học Đà Nẵng bước vào ngưỡng cửa Đại học; - Tạo môi trường, sân chơi bổ ích, giúp hứng thú cho các bạn sinh viên, tân sinh viên có tham gia các hoạt động đặc sắc của chương trình; - Có cơ hội giao lưu, tiếp xúc với các bạn sinh viên đồng trang lứa. - Tăng độ nhận diện, hình ảnh thương hiệu Trường Đại học Kinh tế - Đại học Đà Nẵng để chuẩn bị cho công tác tuyển sinh năm học mới.', 'Thời gian tổ chức: Từ 13h00 đến 21h30 ngày 11 tháng 10 năm 2025 (Thứ Bảy). Địa điểm tổ chức (dự kiến): Khuôn viên Trường Đại học Kinh tế - ĐHĐN III. NỘI DUNG THỰC HIỆN 1. Nội dung chương trình: Chương trình Chào đón Tân Sinh viên khóa 51 bao gồm ba nhóm hoạt động chính: - Phần 1: Từ 13h00 - 17h30: Ngày hội chào đón Tân Sinh viên khóa 51. - Phần 2: Từ 18h00 - 19h00: Trao thưởng cho sinh viên có thành tích xuất sắc trong năm học 2024 - 2025. - Phần 3: Từ 19h00 - 21h30: Đêm văn nghệ Chào đón Tân Sinh viên khóa 51. Chủ đề xuyên suốt của chương trình và các phần thi sẽ được công bố sau khi các đội thi hoàn thành việc gửi danh sách tham gia.', 'ăng độ nhận diện, hình ảnh thương hiệu Trường Đại học Kinh tế - Đại học Đà Nẵng để chuẩn bị cho công tác tuyển sinh năm học mới. Yêu cầu: - Các hoạt động trong chương trình phải đảm bảo có sự phối hợp chặt chẽ, đồng bộ, thiết thực và hiệu quả; - Các hoạt động phong phú, sinh động, sáng tạo, thu hút nhiều học sinh, sinh viên trong và ngoài nhà trường tham gia. ĐỐI TƯỢNG, THỜI GIAN, ĐỊA ĐIỂM: 1. Đối tượng tham gia: Chương trình Chào đón Tân Sinh viên khóa 51 là chương trình dành sinh viên, tân sinh viên của Trường Đại học Kinh tế - Đại học Đà Nẵng. Quy mô dự kiến: khoảng 700 sinh viên. - Điều động bắt buộc đối với các Câu lạc bộ, Đội, Nhóm (phụ lục 1 kèm theo). Mỗi Câu lạc bộ, Đội, Nhóm thành lập đội thi với số lượng 25 thành viên trong đó 15 Tân Sinh viên khóa 51, 10 sinh viên khóa 50 trở về trước.']","['## HỘI SINH VIÊN VIỆT NAM ĐẠI HỌC ĐÀ NẴNG **BCH TRƯỜNG ĐẠI HỌC KINH TẾ** *** Số: 22-KH/HSV-VP _Đà Nẵng, ngày 23 tháng 9 năm 2025_ ## ** KẾ HOẠCH** ## ** Tổ chức Chương trình Chào đón Tân Sinh viên khóa 51** **---------------------** Thực hiện Chương trình Công tác Hội và phong trào sinh viên năm học 2025 - 2026, Ban Chấp hành Hội Sinh viên Trường Đại học Kinh tế - Đại học Đà Nẵng xây dựng Kế hoạch tổ chức Chương trình Chào đón Tân Sinh viên khóa 51 với các nội dung cụ thể như sau: ## ** I. MỤC ĐÍCH, YÊU CẦU** ## **1. Mục đích:** - Chào mừng các bạn Tân Sinh viên khoá 51 của Trường Đại học Kinh tế - Đại học Đà Nẵng bước vào ngưỡng cửa Đại học; - Tạo môi trường, sân chơi bổ ích, giúp hứng thú cho các bạn sinh viên, tân sinh viên có tham gia các hoạt động đặc sắc của chương trình; - Có cơ hội giao lưu, tiếp xúc với các bạn sinh viên đồng trang lứa. - Tăng độ nhận diện, hình ảnh thương hiệu Trường Đại học Kinh tế - Đại học Đà Nẵng để chuẩn bị cho công tác tuyển sinh năm học mới. **2. Yêu cầu:** - Các hoạt động trong chương trình phải đảm bảo có sự phối hợp chặt chẽ, đồng bộ, thiết thực và hiệu quả; - Các hoạt động phong phú, sinh động, sáng tạo, thu hút nhiều học sinh, sinh viên trong và ngoài nhà trường tham gia. ## ** II. ĐỐI TƯỢNG, THỜI GIAN, ĐỊA ĐIỂM:** ## **1. Đối tượng tham gia:** Chương trình Chào đón Tân Sinh viên khóa 51 là chương trình dành sinh viên, tân sinh viên của Trường Đại học Kinh tế - Đại học Đà Nẵng. Quy mô dự kiến: khoảng 700 sinh viên. - Điều động bắt buộc đối với các Câu lạc bộ, Đội, Nhóm (phụ lục 1 kèm theo). Mỗi Câu lạc bộ, Đội, Nhóm thành lập đội thi với số lượng 25 thành viên trong đó 15 Tân Sinh viên khóa 51, 10 sinh viên khóa 50 trở về trước. - Khuyến khích tham gia đối với các Liên chi Hội. Mỗi Liên chi Hội thành lập đội thi với số lượng 25 thành viên trong đó 15 Tân Sinh viên khóa 51, 10 sinh viên khóa 50 trở về trước. Danh sách đội thi được gửi về cho Ban Tổ chức theo địa chỉ email: congtachsvdhkt@gmail.com trước 22h00 ngày 27/9/2025 (Thứ Bảy). (Mẫu danh sách theo phụ lục 2). ## **2. Thời gian tổ chức:** Từ 13h00 đến 21h30 ngày 11 tháng 10 năm 2025 (Thứ Bảy). **3. Địa điểm tổ chức (dự kiến):** Khuôn viên Trường Đại học Kinh tế - ĐHĐN **']","Khuôn viên Trường Đại học Kinh tế - Đại học Đà Nẵng được dự kiến là địa điểm tổ chức chương trình Chào đón Tân Sinh viên khóa 51. Sự lựa chọn này có ý nghĩa quan trọng trong việc tạo ra một môi trường thân thiện và gần gũi cho các tân sinh viên, giúp họ dễ dàng hòa nhập vào không gian học tập và sinh hoạt của trường. Đồng thời, việc tổ chức tại khuôn viên trường cũng góp phần tăng cường độ nhận diện và hình ảnh thương hiệu của Trường Đại học Kinh tế - Đại học Đà Nẵng, chuẩn bị cho công tác tuyển sinh năm học mới.  Tóm lại, Khuôn viên Trường Đại học Kinh tế không chỉ là nơi diễn ra các hoạt động chào đón mà còn là biểu tượng cho sự khởi đầu mới của các tân sinh viên trong hành trình học tập tại trường.","Khuôn viên Trường Đại học Kinh tế is the proposed location for the welcome program for new students, which aims to create an engaging environment for approximately 700 participants, including new and returning students, to interact and participate in various activities.",0.5,0.7303636717574903,0.9999999999666667,1.0
